{"balance":{"CISO":{"definition":"net generation - demand - total interchange (EIA identity: net generation = demand + interchange), hours where all three are clean","mean_abs_resid_mw":636.5841,"mean_resid_mw":-415.2784,"n_hours":40146,"p99_abs_resid_mw":1709.55},"ERCO":{"definition":"net generation - demand - total interchange (EIA identity: net generation = demand + interchange), hours where all three are clean","mean_abs_resid_mw":0.4563,"mean_resid_mw":-0.0858,"n_hours":40766,"p99_abs_resid_mw":2.0}},"generation_vs_total":{"CISO":{"definition":"100 * (sum of fuel net generation - total net generation) / total net generation, hours where all fuels and a clean total exist","hours_gt_2pct":1,"mean_abs_resid_pct":0.0033,"mean_signed_resid_pct":0.0005,"n_hours":40570,"p99_abs_resid_pct":0.0135},"ERCO":{"definition":"100 * (sum of fuel net generation - total net generation) / total net generation, hours where all fuels and a clean total exist","hours_gt_2pct":1992,"mean_abs_resid_pct":0.2761,"mean_signed_resid_pct":0.0444,"n_hours":40767,"p99_abs_resid_pct":4.6591}},"invariants":["grid_slots = raw_rows + missing_slots","raw_rows = kept + null_value + flagged_outlier + timing_excluded (flagged_outlier = flagged_range + flagged_spike; timing_excluded = rows within one local day of a timing-convention change or colliding after the per-series timing correction)","imputed_short_gap hours are a subset of non-kept slots filled by linear interpolation and are never used as forecast targets"],"ledger":[{"ba":"CISO","flagged_outlier":1,"flagged_range":0,"flagged_spike":1,"fuel":"","grid_slots":40776,"imputed_short_gap":11,"kept":40694,"kind":"D","missing_slots":1,"null_value":9,"raw_rows":40775,"timing_excluded":71},{"ba":"CISO","flagged_outlier":0,"flagged_range":0,"flagged_spike":0,"fuel":"","grid_slots":40776,"imputed_short_gap":0,"kept":40704,"kind":"DF","missing_slots":72,"null_value":0,"raw_rows":40704,"timing_excluded":0},{"ba":"CISO","flagged_outlier":14,"flagged_range":13,"flagged_spike":1,"fuel":"","grid_slots":40776,"imputed_short_gap":9,"kept":40588,"kind":"NG","missing_slots":24,"null_value":8,"raw_rows":40752,"timing_excluded":142},{"ba":"CISO","flagged_outlier":0,"flagged_range":0,"flagged_spike":0,"fuel":"","grid_slots":40776,"imputed_short_gap":0,"kept":40320,"kind":"TI","missing_slots":456,"null_value":0,"raw_rows":40320,"timing_excluded":0},{"ba":"CISO","flagged_outlier":0,"flagged_range":0,"flagged_spike":0,"fuel":"NG","grid_slots":40776,"imputed_short_gap":0,"kept":40579,"kind":"GEN","missing_slots":47,"null_value":8,"raw_rows":40729,"timing_excluded":142},{"ba":"CISO","flagged_outlier":0,"flagged_range":0,"flagged_spike":0,"fuel":"COL","grid_slots":40776,"imputed_short_gap":0,"kept":40594,"kind":"GEN","missing_slots":32,"null_value":8,"raw_rows":40744,"timing_excluded":142},{"ba":"CISO","flagged_outlier":0,"flagged_range":0,"flagged_spike":0,"fuel":"NUC","grid_slots":40776,"imputed_short_gap":0,"kept":40600,"kind":"GEN","missing_slots":26,"null_value":8,"raw_rows":40750,"timing_excluded":142},{"ba":"CISO","flagged_outlier":0,"flagged_range":0,"flagged_spike":0,"fuel":"OIL","grid_slots":40776,"imputed_short_gap":0,"kept":40599,"kind":"GEN","missing_slots":27,"null_value":8,"raw_rows":40749,"timing_excluded":142},{"ba":"CISO","flagged_outlier":0,"flagged_range":0,"flagged_spike":0,"fuel":"OTH","grid_slots":40776,"imputed_short_gap":0,"kept":40602,"kind":"GEN","missing_slots":24,"null_value":8,"raw_rows":40752,"timing_excluded":142},{"ba":"CISO","flagged_outlier":0,"flagged_range":0,"flagged_spike":0,"fuel":"SUN","grid_slots":40776,"imputed_short_gap":0,"kept":40602,"kind":"GEN","missing_slots":24,"null_value":8,"raw_rows":40752,"timing_excluded":142},{"ba":"CISO","flagged_outlier":0,"flagged_range":0,"flagged_spike":0,"fuel":"WAT","grid_slots":40776,"imputed_short_gap":0,"kept":40579,"kind":"GEN","missing_slots":47,"null_value":8,"raw_rows":40729,"timing_excluded":142},{"ba":"CISO","flagged_outlier":0,"flagged_range":0,"flagged_spike":0,"fuel":"WND","grid_slots":40776,"imputed_short_gap":0,"kept":40602,"kind":"GEN","missing_slots":24,"null_value":8,"raw_rows":40752,"timing_excluded":142},{"ba":"ERCO","flagged_outlier":0,"flagged_range":0,"flagged_spike":0,"fuel":"","grid_slots":40776,"imputed_short_gap":1,"kept":40775,"kind":"D","missing_slots":1,"null_value":0,"raw_rows":40775,"timing_excluded":0},{"ba":"ERCO","flagged_outlier":0,"flagged_range":0,"flagged_spike":0,"fuel":"","grid_slots":40776,"imputed_short_gap":0,"kept":40776,"kind":"DF","missing_slots":0,"null_value":0,"raw_rows":40776,"timing_excluded":0},{"ba":"ERCO","flagged_outlier":0,"flagged_range":0,"flagged_spike":0,"fuel":"","grid_slots":40776,"imputed_short_gap":0,"kept":40776,"kind":"NG","missing_slots":0,"null_value":0,"raw_rows":40776,"timing_excluded":0},{"ba":"ERCO","flagged_outlier":0,"flagged_range":0,"flagged_spike":0,"fuel":"","grid_slots":40776,"imputed_short_gap":0,"kept":40767,"kind":"TI","missing_slots":9,"null_value":0,"raw_rows":40767,"timing_excluded":0},{"ba":"ERCO","flagged_outlier":0,"flagged_range":0,"flagged_spike":0,"fuel":"NG","grid_slots":40776,"imputed_short_gap":0,"kept":40776,"kind":"GEN","missing_slots":0,"null_value":0,"raw_rows":40776,"timing_excluded":0},{"ba":"ERCO","flagged_outlier":0,"flagged_range":0,"flagged_spike":0,"fuel":"COL","grid_slots":40776,"imputed_short_gap":0,"kept":40776,"kind":"GEN","missing_slots":0,"null_value":0,"raw_rows":40776,"timing_excluded":0},{"ba":"ERCO","flagged_outlier":0,"flagged_range":0,"flagged_spike":0,"fuel":"NUC","grid_slots":40776,"imputed_short_gap":0,"kept":40775,"kind":"GEN","missing_slots":1,"null_value":0,"raw_rows":40775,"timing_excluded":0},{"ba":"ERCO","flagged_outlier":0,"flagged_range":0,"flagged_spike":0,"fuel":"OTH","grid_slots":40776,"imputed_short_gap":0,"kept":40773,"kind":"GEN","missing_slots":3,"null_value":0,"raw_rows":40773,"timing_excluded":0},{"ba":"ERCO","flagged_outlier":0,"flagged_range":0,"flagged_spike":0,"fuel":"SUN","grid_slots":40776,"imputed_short_gap":0,"kept":40772,"kind":"GEN","missing_slots":4,"null_value":0,"raw_rows":40772,"timing_excluded":0},{"ba":"ERCO","flagged_outlier":0,"flagged_range":0,"flagged_spike":0,"fuel":"WAT","grid_slots":40776,"imputed_short_gap":0,"kept":40770,"kind":"GEN","missing_slots":6,"null_value":0,"raw_rows":40770,"timing_excluded":0},{"ba":"ERCO","flagged_outlier":0,"flagged_range":0,"flagged_spike":0,"fuel":"WND","grid_slots":40776,"imputed_short_gap":0,"kept":40776,"kind":"GEN","missing_slots":0,"null_value":0,"raw_rows":40776,"timing_excluded":0}],"schema_version":"v1","tags":{"balance":"DERIVED","generation_vs_total":"DERIVED","ledger":"OBSERVED/DERIVED","weather":"OBSERVED/DERIVED"},"weather":[{"ba":"CISO","hours_expected":40776,"hours_interpolated":20,"hours_missing":10,"hours_observed":40746,"name":"Los Angeles Intl","station_id":"72295023174","weight":0.55},{"ba":"CISO","hours_expected":40776,"hours_interpolated":10,"hours_missing":42,"hours_observed":40724,"name":"San Francisco Intl","station_id":"72494023234","weight":0.2},{"ba":"CISO","hours_expected":40776,"hours_interpolated":30,"hours_missing":25,"hours_observed":40721,"name":"San Diego Intl","station_id":"72290023188","weight":0.15},{"ba":"CISO","hours_expected":40776,"hours_interpolated":31,"hours_missing":75,"hours_observed":40670,"name":"Sacramento Metropolitan","station_id":"72483993225","weight":0.1},{"ba":"ERCO","hours_expected":40776,"hours_interpolated":42,"hours_missing":4,"hours_observed":40730,"name":"Dallas/Fort Worth","station_id":"72259003927","weight":0.38},{"ba":"ERCO","hours_expected":40776,"hours_interpolated":30,"hours_missing":0,"hours_observed":40746,"name":"Houston Intercontinental","station_id":"72243012960","weight":0.35},{"ba":"ERCO","hours_expected":40776,"hours_interpolated":35,"hours_missing":0,"hours_observed":40741,"name":"Austin-Bergstrom","station_id":"72254013904","weight":0.14},{"ba":"ERCO","hours_expected":40776,"hours_interpolated":19,"hours_missing":26,"hours_observed":40731,"name":"San Antonio Intl","station_id":"72253012921","weight":0.13}]}
